{
  "schema_version": "responses_runner_v2.supervisor_session.v1",
  "supervisor_session_id": "sup_frozen_v1",
  "created_at": "2026-04-23T11:00:00+00:00",
  "updated_at": "2026-04-23T12:10:00+00:00",
  "workspace_root": ".",
  "operator_boundary": "headless_discrete_codex_exec_with_deterministic_supervisor_cli",
  "status": "completed",
  "current_phase": "finalization",
  "clarified_task_brief": {
    "path": "automation/tests/fixtures/persisted_v1/artifact.md",
    "sha256": "0000000000000000000000000000000000000000000000000000000000000000",
    "accepted_at": "2026-04-23T11:00:00+00:00",
    "summary": "Frozen compatibility fixture."
  },
  "policy": {
    "review_agents": ["operator_codex", "codex_review_agent", "claude_review_agent"],
    "retry_budgets": {},
    "monitoring": {},
    "human_pause_rules": [],
    "read_only_enforcement_method": "workspace_hash_snapshot"
  },
  "model_defaults": {
    "primary": "gpt-5.5-pro",
    "structural": "gpt-5.5",
    "prompt_cache_retention": "24h",
    "max_output_tokens": 128000,
    "primary_reasoning_effort": "xhigh",
    "structural_reasoning_effort": "high",
    "primary_verbosity": "high",
    "structural_verbosity": "medium"
  },
  "retry_budget": {},
  "monitoring_policy": {
    "poll_interval_seconds": 10,
    "stale_after_seconds": 600,
    "max_refresh_attempts": 3,
    "max_resume_attempts": 1,
    "no_duplicate_submit": true
  },
  "scaffold_versions": [],
  "dry_run_validations": [],
  "runs": [],
  "stage_outcomes": [],
  "monitoring_events": [],
  "review_cycles": [],
  "review_agent_invocations": [],
  "consolidations": [],
  "operator_acceptance_records": [],
  "human_pauses": [],
  "archives": [],
  "approved_review_bundles": [],
  "final_bundle": null,
  "validation_results": [],
  "command_log": [],
  "errors": []
}
